{
    "$schema": "../schemas/dev/mxc-config.schema.0.5.0-dev.json",
    "version": "0.5.0-alpha",
    "containment": "seatbelt",
    "process": {
        "commandLine": "ls /Users && echo FS_ALLOWED || echo FS_BLOCKED",
        "timeout": 10000
    },
    "filesystem": {
        "readwritePaths": ["/tmp"],
        "deniedPaths": ["/Users"]
    },
    "network": {
        "defaultPolicy": "block"
    },
    "experimental": {
        "seatbelt": {
            "mode": "exec"
        }
    }
}
