{
    "$schema": "../../schemas/dev/mxc-config.schema.0.8.0-dev.json",
    "version": "0.8.0-alpha",
    "containment": "apple_container",
    "containerId": "apple-container-allow",
    "process": {
        "commandLine": "printf 'MXC_BACKEND=%s\\n' \"$MXC_BACKEND\" && uname -a",
        "cwd": "/",
        "env": [
            "MXC_BACKEND=apple_container"
        ],
        "timeout": 30000
    },
    "network": {
        "defaultPolicy": "allow"
    },
    "experimental": {
        "apple_container": {
            "image": "docker.io/library/alpine:3.22",
            "cpuCount": 2,
            "memoryMb": 1024
        }
    }
}
